### ISSUE TITLE
apkmirror SSL_ERROR_UNSUPPORTED_VERSION错误

### ISSUE THREAD

**Issue by linsui** [URenko/Accesser#15]
现在 apkmirror 是可以直连的。如果使用 Accesser 出现了 
>连接到 www.apkmirror.com 时发生错误。对等端使用了不支持的安全协议版本。 错误代码：SSL_ERROR_UNSUPPORTED_VERSION

**Comment by miaomiaosoft** [comment]
![截图20190312225327](https://user-images.githubusercontent.com/4084875/54210052-c7cb5000-4519-11e9-85d9-ac6f1c1ddf0e.jpg)

测试没问题

**Comment by linsui** [comment]
我发现 Accesser 长时间运行后会这样，重新打开之后就会恢复正常

**Comment by URenko** [comment]
@linsui 出问题后其他网站（如中文维基）能否访问

**Comment by linsui** [comment]
日志就这么一条，直连可访问
···
2019-03-16 14:27:42 DEBUG    L103 CONNECT www.apkmirror.com:443 HTTP/1.1
···
其他网站没有受影响。
···
2019-03-16 14:27:42 DEBUG    L103 CONNECT www.apkmirror.com:443 HTTP/1.1
2019-03-16 14:28:38 DEBUG    L103 CONNECT www.reddit.com:443 HTTP/1.1
2019-03-16 14:28:38 DEBUG    L103 GET / HTTP/1.1
2019-03-16 14:28:44 DEBUG    L103 CONNECT www.reddit.com:443 HTTP/1.1
2019-03-16 14:28:44 DEBUG    L103 POST / HTTP/1.1
2019-03-16 14:31:20 DEBUG    L103 CONNECT www.quora.com:443 HTTP/1.1
2019-03-16 14:31:21 DEBUG    L103 GET /search?q=asx HTTP/1.1
2019-03-16 14:31:29 DEBUG    L103 CONNECT log.quora.com:443 HTTP/1.1
2019-03-16 14:31:30 DEBUG    L103 POST /ajax/batched_log_POST HTTP/1.1
2019-03-16 14:34:08 DEBUG    L103 CONNECT zh.wikipedia.org:443 HTTP/1.1
2019-03-16 14:34:08 DEBUG    L103 GET /w/load.php?lang=zh-cn&modules=site.styles&only=styles&skin=vector HTTP/1.1
···
错误信息是立刻显示的
···
连接到 www.apkmirror.com 时发生错误。对等端使用了不支持的安全协议版本。 错误代码：SSL_ERROR_UNSUPPORTED_VERSION
···

**Comment by URenko** [comment]
@linsui 问题是否依旧存在？最好下载最新的源码测试下。
另外apkmirror只有部分地区能直连，故暂不移除

**Comment by linsui** [comment]
我现在通过 Accesser 是可以连接的，不清楚问题是否仍然存在。如果问题再次出现我再反馈吧。

**Comment by linsui** [comment]
问题依然存在

**Comment by URenko** [comment]
emmm，能用Wireshark抓下出错时的流量吗

**Comment by linsui** [comment]
No.  | Time      | Source      | Destination | Protocol | Length | Info
---- | --------- | ----------- | ----------- | -------- | ------ | --------------------------------------------------------------------------------------------
6863 | 32.331957 | 192.168.1.1 | 192.168.1.2 | TCP      | 74     | 35770 > 7655 [SYN] Seq=0 Win=65535 Len=0 MSS=1460 SACK_PERM=1 TSval=262751305 TSecr=0 WS=256
6864 | 32.332107 | 192.168.1.2 | 192.168.1.1 | TCP      | 66     | 7655 > 35770 [SYN, ACK] Seq=0 Ack=1 Win=65535 Len=0 MSS=1460 WS=256 SACK_PERM=1
6868 | 32.348288 | 192.168.1.1 | 192.168.1.2 | TCP      | 60     | 35770 > 7655 [ACK] Seq=1 Ack=1 Win=87808 Len=0
6869 | 32.348666 | 192.168.1.1 | 192.168.1.2 | HTTP     | 257    | CONNECT www.apkmirror.com:443 HTTP/1.1
6870 | 32.350457 | 192.168.1.2 | 192.168.1.1 | HTTP     | 93     | HTTP/1.1 200 Connection Established
6871 | 32.353622 | 192.168.1.1 | 192.168.1.2 | TCP      | 60     | 35770 > 7655 [ACK] Seq=204 Ack=40 Win=87808 Len=0
6873 | 32.363115 | 192.168.1.1 | 192.168.1.2 | TLSv1.2  | 770    | Client Hello
6879 | 32.389657 | 192.168.1.2 | 192.168.1.1 | TLSv1.2  | 1482   | Server Hello, Certificate, Server Key Exchange, Server Hello Done
6880 | 32.391801 | 192.168.1.1 | 192.168.1.2 | TLSv1.2  | 61     | Alert (Level: Fatal, Description: Protocol Version)
6881 | 32.391974 | 192.168.1.2 | 192.168.1.1 | TCP      | 54     | 7655 > 35770 [RST, ACK] Seq=1468 Ack=927 Win=0 Len=0
6882 | 32.392227 | 192.168.1.1 | 192.168.1.2 | TCP      | 60     | 35770 > 7655 [RST, ACK] Seq=927 Ack=1468 Win=90624 Len=0

**Comment by URenko** [comment]
有具体点的吗，比如Client Hello和Server Hello的数据包

**Comment by linsui** [comment]
我对 wireshark 不熟啊 :joy: 怎么设置你指点一下。直接解压运行的。

**Comment by URenko** [comment]
结束后，文件->保存，再发过来吧
话说你是在两台设备上运行？

**Comment by linsui** [comment]
对，在本机上我抓不到包

**Comment by linsui** [comment]
Frame 7: 770 bytes on wire (6160 bits), 770 bytes captured (6160 bits) on interface 0
Ethernet II, Src: Hiwifi_35:f1:c5 (d4:ee:07:35:f1:c5), Dst: AsustekC_4a:7a:11 (ac:9e:17:4a:7a:11)
Internet Protocol Version 4, Src: 192.168.8.222, Dst: 192.168.8.216
Transmission Control Protocol, Src Port: 36196, Dst Port: 17655, Seq: 204, Ack: 40, Len: 716
Hypertext Transfer Protocol
    [Proxy-Connect-Hostname: www.apkmirror.com]
    [Proxy-Connect-Port: 443]
Transport Layer Security
    TLSv1.2 Record Layer: Handshake Protocol: Client Hello
        Content Type: Handshake (22)
        Version: TLS 1.0 (0x0301)
        Length: 711
        Handshake Protocol: Client Hello
            Handshake Type: Client Hello (1)
            Length: 707
            Version: TLS 1.2 (0x0303)
            Random: 92 3d 27 12 66 5f 32 44 9c 4b e1 a4 72 5b e1 07 …
            Session ID Length: 32
            Session ID: ec 29 50 62 c8 27 59 9d 39 84 65 09 7b d6 b7 be …
            Cipher Suites Length: 36
            Cipher Suites (18 suites)
            Compression Methods Length: 1
            Compression Methods (1 method)
            Extensions Length: 598
            Extension: extended_master_secret (len=0)
            Extension: renegotiation_info (len=1)
            Extension: supported_groups (len=14)
            Extension: ec_point_formats (len=2)
            Extension: session_ticket (len=0)
            Extension: application_layer_protocol_negotiation (len=14)
            Extension: status_request (len=5)
            Extension: key_share (len=107)
            Extension: supported_versions (len=9)
            Extension: signature_algorithms (len=24)
            Extension: psk_key_exchange_modes (len=2)
            Extension: encrypted_server_name (len=366)
            Extension: record_size_limit (len=2)

**Comment by URenko** [comment]
本机可以用Loopback Adapter

**Comment by linsui** [comment]
[apkmirror.zip](https://github.com/URenko/Accesser/files/3075685/apkmirror.zip)

**Comment by URenko** [comment]
你用的什么浏览器，以及版本号？
你的浏览器不知为何降级到了TLS1.0

**Comment by linsui** [comment]
Firefox 66

**Comment by linsui** [comment]
我猜 Firefox 的 ESNI 与 Accesser 冲突，我关闭 DoH 后就可以正常通过 Accesser 连接 Apkmirror 了

**Comment by URenko** [comment]
mark一下相关信息：Fiddler+speedpan也会造成部分的TLS降级错误，speedpan使用的是OpenSSL 1.1.1
